,PalabraClave,Recomendaciones
749,flavors,"[{'NombreProducto': 'Blue Buffalo Wilderness Grain-Free Variety Pack Cat Food - 4 Flavors (Salmon, Duck, Turkey, and Chicken) - 12 (3 Ounce) Cans - 3 of Each Flavor', 'PrecioProducto': 38.15}, {'NombreProducto': 'Blue Dog Bakery Natural Low Fat Dog Treats, Meaty Flavors, 16-Ounce Boxes (Pack Of 6)', 'PrecioProducto': nan}, {'NombreProducto': 'Blue Buffalo Wilderness Cat Food Variety Sampler Box - 12 Items - 4 Classic Flavors, 3 Wild Delights Flavors, 2 Rocky Mountain Recipe Flavors, &amp; 3 Wild Cuts Tasty Toppers Pouch Flavors - 3 oz Each', 'PrecioProducto': 28.72}, {'NombreProducto': 'Blue Buffalo Wilderness Dog Treat Variety Pack - 2 Flavors (Denali Blend &amp; Bayou Blend), 8-Ounces Each (2 Total Pouches)', 'PrecioProducto': 14.69}, {'NombreProducto': ""Friskies Pull 'n Play / Party Mix Cat Treat Variety Pack - 6 Items - (3 Pull 'n Play Tender String Packs &amp; 3 Friskies Party Mix Crunch Treats Flavors)"", 'PrecioProducto': 27.5}]"
750,chihuahua,"[{'NombreProducto': 'Cute Pet Bling Rhinestone Pet Cat Dog Bow Tie Collar Necklace Jewelry for Small or Medium Dogs Cats Pets Female Puppies Chihuahua Yorkie Girl Costume Outfits, Light and Adjustble Buckle with Leash in Red XS', 'PrecioProducto': nan}, {'NombreProducto': 'PETFAVORITES&trade; Nappa Leather Dog Collar Cute Cat Collar Necklace Jewelry with Flower Bow Tie and Bell Charm for Pets Kitten Small Dogs Girl Female Teacup Puppies Toy Yorkie Chihuahua Birthday Clothes Costume Accessories, Adjustable Buckle.', 'PrecioProducto': 10.99}, {'NombreProducto': 'Finest Solid Wood Cherry Elevated Dog Feeder - Raised Dog Bowl Stand Or Dog Food Dish Holder - For small DOGS Yorkies Boston Terrier Chihuahua Beagles Terriers Spaniels and more.', 'PrecioProducto': nan}, {'NombreProducto': 'uxcell Pet Chihuahua Twisted Knit Turtleneck Clothes Sweater, XX-Small, Fuchsia', 'PrecioProducto': 8.64}, {'NombreProducto': 'EXPAWLORER Choke Free Small Dog Vest X Frame Design with Soft Mesh, Puppy Adjustable Harness for Teacup Chihuahua Poodle Yorkshire Terrier Red Black, X-Small', 'PrecioProducto': nan}]"
751,equine,"[{'NombreProducto': 'Technyflex Equine Premium Joint Supplement 100 Gram Reduces Pain, Swelling, Inflammation From Arthritis and DJD. 100% New Zealand Greenlipped Mussel With Omega 3&rsquo;s Improves Flexibility And Movement', 'PrecioProducto': 139.99}, {'NombreProducto': 'Ortho Equine Electro-Boost, 80cc', 'PrecioProducto': 24.4}, {'NombreProducto': 'MiracleCorp Products Grooma Equine ManeMaster Combo Comb', 'PrecioProducto': 10.99}, {'NombreProducto': 'Conair Equine FX Fine Curry Comb, Equine Professional Grooming, Purple', 'PrecioProducto': 19.48}, {'NombreProducto': 'Pro Equine Cactus Double S 3-Strand Calf Rope 10.5', 'PrecioProducto': 46.73}]"
752,meal,"[{'NombreProducto': 'Wellness Complete Salmon, Salmon Meal &amp; Deboned Turkey Dry Cat Food - 5 lbs 14 oz (2.7 Kg)', 'PrecioProducto': nan}, {'NombreProducto': 'Treatstik Large Meal and Treat Dispensing Dog Toy', 'PrecioProducto': 34.95}, {'NombreProducto': 'Treatstik Small Blue Meal And Treat Dispensing Dog Toy', 'PrecioProducto': nan}, {'NombreProducto': 'WholeMeals Small Dog Formula Savory Chicken and Vegetables Flavor 7 Meal Bars', 'PrecioProducto': nan}, {'NombreProducto': 'Castor &amp; Pollux Good Buddy Aloe Oatmeal Shampoo and Conditioner, 12 Ounce Bottles (Pack of 6)', 'PrecioProducto': nan}]"
753,male,"[{'NombreProducto': 'Male Doggy Wrap Black - Small', 'PrecioProducto': nan}, {'NombreProducto': 'Cute Pet Bling Rhinestone Pet Cat Dog Bow Tie Collar Necklace Jewelry for Small or Medium Dogs Cats Pets Female Puppies Chihuahua Yorkie Girl Costume Outfits, Light and Adjustble Buckle with Leash in Red XS', 'PrecioProducto': nan}, {'NombreProducto': 'PETFAVORITES&trade; Nappa Leather Dog Collar Cute Cat Collar Necklace Jewelry with Flower Bow Tie and Bell Charm for Pets Kitten Small Dogs Girl Female Teacup Puppies Toy Yorkie Chihuahua Birthday Clothes Costume Accessories, Adjustable Buckle.', 'PrecioProducto': 10.99}, {'NombreProducto': 'Joybies Blue Aloha Piddle Pants(TM) for XX Large Female Dog (23&quot;-26&quot; From Collar to Base of Tail)', 'PrecioProducto': nan}, {'NombreProducto': 'ClearQuest Disposable Dog Diaper Liners, 22-Pack, Absorbent Pads, Extra Protection for Cover-Ups and Male Wraps', 'PrecioProducto': 17.16}]"
754,kittens,"[{'NombreProducto': 'Dog Nail Clippers, Cat Claw Trimmer, For Use on Kittens, Puppies, Small &amp; Medium Breeds, With Safety Stop and Ergonomic Handle, By WPS', 'PrecioProducto': nan}, {'NombreProducto': 'WwWSuppliers Adjustable PU Velvet Suede Leather Bling Skull &amp; Bones Pirate Rhinestones Fashion Collar for Dogs, Puppies, Cats or Kittens', 'PrecioProducto': nan}, {'NombreProducto': 'Happy Jack 8 Oz Paracide Flea and Tick Shampoo for Dogs, Puppies, Cats, and Kittens', 'PrecioProducto': 13.9}, {'NombreProducto': 'KMR Liquid Replacer for Kittens &amp; Cats, 11oz cans, Case of 25', 'PrecioProducto': 286.82}, {'NombreProducto': 'ALEKO PPB18TN Plush Padded Bolster Pet Bed for Puppies Kittens Machine Washable Indoor 17 x 12 x 2.5 Inches Beige', 'PrecioProducto': nan}]"
755,contains,"[{'NombreProducto': 'Buddy&amp;Max Probiotic Chews for Dogs - Digestive Enzymes - Diarrhea, Stomach, Vomit, Gas, Weight Support, Allergy Relief - Contains Prebiotics - Dog Probiotics Supplement - 130 Chews', 'PrecioProducto': 26.45}, {'NombreProducto': 'Buddy&amp;Max Probiotic Chews for Dogs - Digestive Enzymes - Diarrhea, Stomach, Vomit, Gas, Weight Support, Allergy Relief - Contains Prebiotics - Dog Probiotics Supplement - 130 Chews', 'PrecioProducto': 27.85}, {'NombreProducto': 'Buddy&amp;Max Probiotic Chews for Dogs - Digestive Enzymes - Diarrhea, Stomach, Vomit, Gas, Weight Support, Allergy Relief - Contains Prebiotics - Dog Probiotics Supplement - 130 Chews', 'PrecioProducto': 27.85}, {'NombreProducto': 'Buddy&amp;Max Probiotic Chews for Dogs - Digestive Enzymes - Diarrhea, Stomach, Vomit, Gas, Weight Support, Allergy Relief - Contains Prebiotics - Dog Probiotics Supplement - 130 Chews', 'PrecioProducto': 27.85}, {'NombreProducto': 'Buddy&amp;Max Probiotic Chews for Dogs - Digestive Enzymes - Diarrhea, Stomach, Vomit, Gas, Weight Support, Allergy Relief - Contains Prebiotics - Dog Probiotics Supplement - 130 Chews', 'PrecioProducto': 27.85}]"
756,guardian,"[{'NombreProducto': 'Guardian Gear Nylon Adjustable Dog Collar with Plastic Buckles, 3/4-Inch, Black, Size Medium', 'PrecioProducto': nan}, {'NombreProducto': 'Guardian Gear TEAL BLUE Reflective Dog Collar 10&quot;-16&quot;', 'PrecioProducto': nan}, {'NombreProducto': ' Guardian Gear Nylon Mohave Dog Lead, 6-Feet, Black ', 'PrecioProducto': nan}, {'NombreProducto': ' Natguardian Cat Squeezon ', 'PrecioProducto': nan}, {'NombreProducto': 'Guardian Angel Dog Pet Protection 1 Inch Pewter Medal Pendant Collar Charm', 'PrecioProducto': 9.44}]"
757,omega,"[{'NombreProducto': 'Omega Paw Multi-Purpose Scratching Post, assorted colors', 'PrecioProducto': 13.2}, {'NombreProducto': 'Omega One Super Veggie Red Seaweed', 'PrecioProducto': 7.32}, {'NombreProducto': 'Benecoat Fish Oil for Dogs w Krill Oil, Omega 3 Fatty Acids, EPA, DHA, Collagen, MSM and Zinc | Value Size 180ct | the Best Cheese Flavored Skin and Coat Supplement for Sensitive, Dry, Itchy Skin.', 'PrecioProducto': 47.0}, {'NombreProducto': 'Technyflex Equine Premium Joint Supplement 100 Gram Reduces Pain, Swelling, Inflammation From Arthritis and DJD. 100% New Zealand Greenlipped Mussel With Omega 3&rsquo;s Improves Flexibility And Movement', 'PrecioProducto': 139.99}, {'NombreProducto': 'Omega Nibblers Low Sugar &amp; Starch', 'PrecioProducto': 26.95}]"
758,boy,"[{'NombreProducto': ""BLUE MAMA'S BOY - Apple-Of-My-Eye T-Shirts MEDIUM - BLUE MAMA'S BOY"", 'PrecioProducto': nan}, {'NombreProducto': 'GOODBOYS Good Boys&pound;&not;dense Tooth Pet Comb&pound;&not;effective Against Pet Fleas(white)', 'PrecioProducto': nan}, {'NombreProducto': ""Parisian Pet Dog Cat Clothes Tee Shirts Mommy's Boy, Daddy's Girl, Big Brother, Big Sister, Little Brother, Little Sister, I Love Mommy, I Love Daddy"", 'PrecioProducto': 12.95}, {'NombreProducto': 'Fall Out Boy Logo Fashion Image Design Personalized Dog Tag Pet Tag Dogtag Cat Tag Necklace Pendant', 'PrecioProducto': nan}, {'NombreProducto': 'Marina Betta Pals Kit, Boy Theme', 'PrecioProducto': nan}]"
759,freshwater,"[{'NombreProducto': 'Spectrastone Special Light Blue Aquarium Gravel for Freshwater Aquariums, 25-Pound Bag', 'PrecioProducto': 26.91}, {'NombreProducto': 'LVAC Liquid Gravel Vac - Freshwater - 64 oz.', 'PrecioProducto': nan}, {'NombreProducto': 'API REPLACEMENT TEST TUBES WITH CAPS For Any Aquarium Test Kit Including API Freshwater Master Test Kit 24-Count Box', 'PrecioProducto': 17.36}, {'NombreProducto': 'One Stop Aquatics Live Freshwater Bladder Snails - Great feeders! from Shrimp Boutique', 'PrecioProducto': nan}, {'NombreProducto': 'Spectrastone Deep River Pebble for Freshwater Aquariums, 5-Pound Bag', 'PrecioProducto': 10.4}]"
760,rolls,"[{'NombreProducto': 'Retriever Rolls Rawhide 9-10&quot; Single', 'PrecioProducto': 5.99}, {'NombreProducto': 'Paw Naturaw Holistic Variety Case (4 Rolls Organic Chicken, 4 Rolls Organic Turkey, 3 Rolls Organic Beef, 3 Rolls Diet Grass Fed Organic Bison)', 'PrecioProducto': nan}, {'NombreProducto': 'Green N Pack Refill Bags Value Pack 10 Rolls, 200 Count (8 packs plus a free bone dispenser)', 'PrecioProducto': 59.5}, {'NombreProducto': 'Five Star Pet Barrel Style Dispenser with 2 Rolls Made in USA Easy Open Poop Bags Dog Waste Bags', 'PrecioProducto': 6.99}, {'NombreProducto': 'Ims Pet 680311 4-Inch Rolls Curls Peanut Butter For Pets, 1-Pound', 'PrecioProducto': nan}]"
761,dogit,"[{'NombreProducto': 'Dogit Style Ceramic Dish, Round Pattern', 'PrecioProducto': nan}, {'NombreProducto': 'Dogit Mock-Neck Dog Hoodie, X-Large, Purple', 'PrecioProducto': nan}, {'NombreProducto': 'Dogit Plush Worm, Red Apple', 'PrecioProducto': nan}, {'NombreProducto': 'Dogit Hagen Puppy Toy', 'PrecioProducto': 12.49}, {'NombreProducto': 'Dogit Faux Leather Biker Dog Jacket, Medium, Black', 'PrecioProducto': nan}]"
762,jewelry,"[{'NombreProducto': 'Cute Pet Bling Rhinestone Pet Cat Dog Bow Tie Collar Necklace Jewelry for Small or Medium Dogs Cats Pets Female Puppies Chihuahua Yorkie Girl Costume Outfits, Light and Adjustble Buckle with Leash in Red XS', 'PrecioProducto': nan}, {'NombreProducto': 'VALYRIA Jewelry Dog Bone Urn Pendant Necklace,Stainless Steel Memorial Jewelry', 'PrecioProducto': nan}, {'NombreProducto': 'Mini 1000g X 0.1g LCD Display Pocket Digital Scale Electronic Jewelry Scales', 'PrecioProducto': nan}, {'NombreProducto': 'Heavens Jewelry RED Mickey Mouse Charm for Zipper Pull PET Dog CAT Collar Leash Purse DIY ETC', 'PrecioProducto': 6.99}, {'NombreProducto': 'PETFAVORITES&trade; Nappa Leather Dog Collar Cute Cat Collar Necklace Jewelry with Flower Bow Tie and Bell Charm for Pets Kitten Small Dogs Girl Female Teacup Puppies Toy Yorkie Chihuahua Birthday Clothes Costume Accessories, Adjustable Buckle.', 'PrecioProducto': 10.99}]"
763,3.5,"[{'NombreProducto': 'Chainlink Splitter Compatible iPhone 7, 7 Plus, 8, 8 Plus, X, iPad, iPad Pro, 2 in 1 Dual Ports, 3.5 mm Audio + Charge Cable Adapter, iOS 12 Later, Sync, Music Control.', 'PrecioProducto': nan}, {'NombreProducto': 'Exotic Nutrition Glider-Cal 3.5 oz. - Sugar Glider Calcium Supplement', 'PrecioProducto': 17.99}, {'NombreProducto': 'ONE Purina Beyond White Meat Chicken and Whole Oat Meal Recipe, 3.50 lb', 'PrecioProducto': 13.99}, {'NombreProducto': 'AquaTunes 3.5 Gallon Fish Aquarium Sleep Sound Machine, Pre-Recorded Natures Sound, MP3 Player and Speaker Included', 'PrecioProducto': 47.77}, {'NombreProducto': 'Royal Treatment Organic Fresh Currant and Blackberry with Organic Oatmeal Tearless and Brightening Shampoo for Pets, 13.5-Ounce', 'PrecioProducto': nan}]"
764,parakeet,"[{'NombreProducto': ""Nature's Instinct Rythemwise Silly Saucer Small for Parakeets, Cockatiels, and Similar Birds"", 'PrecioProducto': 9.74}, {'NombreProducto': 'Canary Finch Parakeet Cockatiel LoveBird Bird Cage with Stand 18x14x63&quot;H', 'PrecioProducto': 64.98}, {'NombreProducto': 'Birds LOVE Spray Millet for Birds Cockatiel Lovebird Parakeet Finch Canary All Parrots Healthy Treat', 'PrecioProducto': 105.99}, {'NombreProducto': 'HPD Parrot Bird Finch Cage Cockatiel Parakeet Ladder Iron House Pet Supply', 'PrecioProducto': 181.99}, {'NombreProducto': 'Bonka Bird Toys Play 3 Foot Toy 3 Roller Foraging Jingle Balls Cockatiel Parakeet cage Parrot cat Conure', 'PrecioProducto': 6.93}]"
765,wear,"[{'NombreProducto': 'Hands Free Dog Leash with Waist Wearing - Double Handle Reflective Bungee Leash with Adjustable Waist Belt &ndash; Perfect for Running, Jogging or Walking - Ideal for Medium to Large Dogs', 'PrecioProducto': 1.96}, {'NombreProducto': 'Sassy Dog Wear 14-24-Inch Black Nylon 2-Way Coupler, Large', 'PrecioProducto': nan}, {'NombreProducto': ""Sassy Dog Wear 3/4&quot; x 6' Bandana Dog Leash"", 'PrecioProducto': 10.19}, {'NombreProducto': 'Sassy Dog Wear 1/2&quot; x 8&quot;-16&quot; Stripe Dog Harness', 'PrecioProducto': 4.0}, {'NombreProducto': 'ETOSELL Pet Dog Clothes Hawaiian T Shirt Summer Apparel Clothing Beachwear Ye...', 'PrecioProducto': nan}]"
766,essentials,"[{'NombreProducto': 'Songbird Essentials SE958 Heavy Duty Plastic Gourd Porches (Set of 1)', 'PrecioProducto': 13.4}, {'NombreProducto': 'Alcott Essentials 40 Count Adventure Wipes', 'PrecioProducto': nan}, {'NombreProducto': 'Glucosamine Chondroitin Hip and Joint Supplements for Dog Arthritis and Hip Dysphasia by 4Paws Essentials - Best Arthritis Pain Relief Includes Omega 3 For Dogs 60 Chewable Tablets', 'PrecioProducto': nan}, {'NombreProducto': 'Vita-Licious Essentials - Natural Herbal Treats For Rabbits And Guinea Pigs', 'PrecioProducto': 15.95}, {'NombreProducto': 'Le Salon Essentials Rubber Grooming Brush', 'PrecioProducto': 8.99}]"
767,teaser,"[{'NombreProducto': 'lesotc Cat Toys Wand, 2PCS Cat Sticky Toys Rainbow Ribbon with Built in Bell, Teaser and Exerciser for Cat and Kitten', 'PrecioProducto': 9.99}, {'NombreProducto': 'Super Bird Creations 28 by 11-Inch Triangle Teasers Bird Toy, Large', 'PrecioProducto': 22.49}, {'NombreProducto': 'Prevue Pet Products Tropical Teasers Dynamo Bird Toy, Multicolor', 'PrecioProducto': 11.12}, {'NombreProducto': 'Ethical Pets Fun Knits Fish Teaser Wand Catnip Toy', 'PrecioProducto': 11.5}, {'NombreProducto': 'LSD 1x Funny Cat Kitten Pet Sisal Rope Weave Ball Teaser Play Chewing Rattle Scratch catch toy', 'PrecioProducto': nan}]"
768,digital,"[{'NombreProducto': 'AODE&reg; Digital LCD Fish Tank Aquarium Water Terrarium Refrigerator Freezer Sensor Thermometer -58&deg;F to +158&deg;F with Clock 100575', 'PrecioProducto': nan}, {'NombreProducto': 'Cozy Critter Navy Digital Camouflage Dog Collar', 'PrecioProducto': 16.95}, {'NombreProducto': 'Hot Spot Wireless LCD Remote Digital Dog Training Collar Shock and Bark Collar 100% Waterproof with 900 Feet Range', 'PrecioProducto': nan}, {'NombreProducto': 'Mini 1000g X 0.1g LCD Display Pocket Digital Scale Electronic Jewelry Scales', 'PrecioProducto': nan}, {'NombreProducto': 'ZIEIS Digital Bird Scale | A42SS-NMTP | Wooden T Perch | Suction Cup | 1.0 Gram or 0.05 Ounce Accuracy | 2000 Gram or 70 Ounce Capacity | Stainless Steel Platform', 'PrecioProducto': 79.97}]"
769,earth,"[{'NombreProducto': 'Emergency Zone Dog Survival Kit: Bug Out, Emergency, Travel Kits, First Aid. Prepare Your Dog Vacations, Trips, Hurricanes, Earthquakes, Wildfires Much More', 'PrecioProducto': 59.99}, {'NombreProducto': 'Diatomaceous Earth 2 Lbs.(POUNDS) 100% Food Grade DE Natural', 'PrecioProducto': 11.95}, {'NombreProducto': 'Earth friendly Compostable Dog Waste Bags by bioDOGradablebags.com', 'PrecioProducto': nan}, {'NombreProducto': 'Earth s Balance Stool Destroyer 32 oz.', 'PrecioProducto': nan}, {'NombreProducto': 'Earth Animal USA Chicken Cutlets Youth Healthy Puppy Treats', 'PrecioProducto': nan}]"
770,cartridge,"[{'NombreProducto': 'Koller Products Filter Cartridge Pre-Assembled fits Tom Mini Power Filter (TM1250), 3-Pack', 'PrecioProducto': 14.59}, {'NombreProducto': 'Catit Drinking Fountain Replacement Carbon Filter Cartridge for Fresh &amp; Clear Drinking Fountain - 3-Pack', 'PrecioProducto': 5.67}, {'NombreProducto': 'K&amp;H Pet Products CleanFlow Replacement Filter Cartridges 3Pk', 'PrecioProducto': 4.59}, {'NombreProducto': 'Marineland Eclipse Rite-Size H Replacement Filter Cartridge, by Eclipse Rite-Size', 'PrecioProducto': 28.23}, {'NombreProducto': '3-Pack, Size H,, Rite-Size Cartridge Refills', 'PrecioProducto': nan}]"
771,release,"[{'NombreProducto': 'Cetacea Soft Martingale Collar with Quick Release, Large, Blue', 'PrecioProducto': 12.59}, {'NombreProducto': ""Objet D'Art Release #250 &quot;The Vatican&quot; Catholic Holy City Handmade Jeweled Enameled Metal Trinket Box"", 'PrecioProducto': nan}, {'NombreProducto': 'Coastal Pet Tuff Side Release Adjustable Dog Collar (Hunter Green, 26 Inch L x 1 Inch W)', 'PrecioProducto': 8.75}, {'NombreProducto': 'Hollywood Quick Release Ultra Suede Harness, Pink Leopard, XS 10in-12in', 'PrecioProducto': nan}, {'NombreProducto': 'Cetacea Drag Free Leash with Quick Release Handle, 8-Feet, Black', 'PrecioProducto': nan}]"
772,sheet,"[{'NombreProducto': 'Cooling Dog Bed Cover Fitted Sheet in Cappuccino', 'PrecioProducto': nan}, {'NombreProducto': 'Weatherbeeta Cotton Show Sheet 78 Navy/Red/White', 'PrecioProducto': nan}, {'NombreProducto': 'HILASON 78 UV PROTECT MESH BUG MOSQUITO HORSE FLY SHEET SUMMER SPRING WHITE', 'PrecioProducto': nan}, {'NombreProducto': 'Weatherbeeta Dura Mesh Detach-A-Neck Fly Sheet', 'PrecioProducto': nan}, {'NombreProducto': 'Country Brook Design Deluxe Sheet Music on Gold Ribbon Dog Collar', 'PrecioProducto': 12.95}]"
773,sponge,"[{'NombreProducto': 'Ocean Five Inc Pre-Filter Sponge Roll', 'PrecioProducto': nan}, {'NombreProducto': 'Aquarium Bio Cylinder Nano Sponge Filter 2&quot; x 4.75&quot;, Set of 6', 'PrecioProducto': 15.99}, {'NombreProducto': 'Leegoal(TM) Blue Soft Sponge White Dots Strawberry Pet Cat Dog House Bed With Warm Plush Pad(L Size)', 'PrecioProducto': nan}, {'NombreProducto': 'Penn Plax Cascade 700/1000 GPH Canister Filter Aquarium Bio Sponge Replacement, 1 Pack', 'PrecioProducto': 4.4}, {'NombreProducto': 'Spongebob/Patrick 2pc Ornament Combo Pack', 'PrecioProducto': 12.5}]"
774,holistic,"[{'NombreProducto': 'Paw Naturaw Holistic Variety Case (4 Rolls Organic Chicken, 4 Rolls Organic Turkey, 3 Rolls Organic Beef, 3 Rolls Diet Grass Fed Organic Bison)', 'PrecioProducto': nan}, {'NombreProducto': 'Halo Holistic Grain Free Natural Wet Cat Food for Adult Cats with Sensitive Stomachs', 'PrecioProducto': 22.54}, {'NombreProducto': 'Holistic Select Grain Free Salmon, Mackerel &amp; Whitefish Pate Recipe Canned Dog - 12x13 oz', 'PrecioProducto': nan}, {'NombreProducto': 'Wholistic Pet Organics Feline Wild Deep Sea Salmon Oil Spray Supplement, 4 fl. oz', 'PrecioProducto': 18.85}, {'NombreProducto': '(3 Pack) Solid Gold Garlic Holistic Doggie Bagels, 14.4 Ounces each', 'PrecioProducto': nan}]"
775,slicker,"[{'NombreProducto': 'Lawrence Tender Care Soft Slicker Brush - Small Dogs w/ Fine Hair', 'PrecioProducto': 12.95}, {'NombreProducto': 'Pet Waterproof Clothes Dog Cat Hoodie Raincoat Slicker', 'PrecioProducto': nan}, {'NombreProducto': 'PETBABA Dog Raincoat, Reflective Safe at Night Walk, Waterproof Poncho Hood Suitable Rainy Day, Rain Coat Jacket Slicker in Winter Cold Snow Weather', 'PrecioProducto': 7.99}, {'NombreProducto': 'Master Grooming Tools Stainless Steel Turn N Lock Pet Slicker Brush with Rubber Handle, 6-1/2-Inch', 'PrecioProducto': nan}, {'NombreProducto': 'Pet Kingdom Reflective Strips Pet Dog Rain Slicker Raincoat Pet Rain Jacket', 'PrecioProducto': nan}]"
776,gate,"[{'NombreProducto': 'Extra Wide Pet Gate w/ Door by Carlson', 'PrecioProducto': nan}, {'NombreProducto': 'Hammertone Gray Steel Adjustable Vehicle Pet Barrier with Door Car Pet Barrier with Door, Vehicle Dog Gate, Auto Pet Barrier, Keeps Your Pet in the Back, Ride with Your Pet', 'PrecioProducto': nan}, {'NombreProducto': 'Richell Option Frame for Auto Deluxe Pet Gate', 'PrecioProducto': nan}, {'NombreProducto': 'Crown Pet 30 in. Tall Auto-Close Pressure Mounted Pet Gate with Extensions', 'PrecioProducto': 67.99}, {'NombreProducto': ""CISNO Magnetic 2 Way Pet Cat Kitten Dog Supply Safe Moustiquaire Screen Flap Door Gate Large(flap:12''x14''/frame: 14''x18'')"", 'PrecioProducto': nan}]"
777,2019,"[{'NombreProducto': '[NEW 2019] Humane Bark collar-Dog bark Collar-Anti Barking Collar Small Dogs Medium Large Dogs-Rechargeable Waterproof Anti bark Collar-No bark Collars Sound Warning Vibration Electric Stimulation', 'PrecioProducto': 36.95}, {'NombreProducto': 'ELZU.US [Newest 2019 Bark Collar Upgraded Microprocessor Barking Detection - Best No Bark Device w/ 3 Extra Batteries - Beep, Vibration, Shock for Small, Medium, Large Dogs All Breeds Up to 120 LBS', 'PrecioProducto': 6.04}, {'NombreProducto': 'ELZU.US [Newest 2019 Bark Collar Upgraded Microprocessor Barking Detection - Best No Bark Device w/ 3 Extra Batteries - Beep, Vibration, Shock for Small, Medium, Large Dogs All Breeds Up to 120 LBS', 'PrecioProducto': 6.04}, {'NombreProducto': 'Ultimate Pet Liner Ford Explorer 2013-2019', 'PrecioProducto': 350.0}, {'NombreProducto': 'HAEOR Flea Collar and Tick Control for Dogs - Enhanced Natural Ingredients for Flea Treatment and Tick Repellent - Waterproof and 8 Months Continuous Protection Dogs [2019 Upgrade Version]', 'PrecioProducto': 17.95}]"
778,meat,"[{'NombreProducto': 'THE REAL MEAT COMPANY 828102 Cat Jerky Chicken/Venison Treat, 3-Ounce', 'PrecioProducto': 8.85}, {'NombreProducto': 'ONE Purina Beyond White Meat Chicken and Whole Oat Meal Recipe, 3.50 lb', 'PrecioProducto': 13.99}, {'NombreProducto': 'Evangers All Meat Natural - Beef, Chicken &amp; Liver - 12x13 oz', 'PrecioProducto': nan}, {'NombreProducto': 'Fancy Feast Elegant Medleys White Meat Chicken Florentine with Garden Greens (24/3-oz cans)', 'PrecioProducto': nan}, {'NombreProducto': 'The Real Meat Company 828416 Dog Bitz 95-Percent Lamb/Liver Jerky Treat, 4-Ounce', 'PrecioProducto': 8.94}]"
779,keychain,"[{'NombreProducto': 'Karate Taekwondo 5 Tenets Courtesy Integrity - Military Dog Tag Luggage Keychain', 'PrecioProducto': 9.99}, {'NombreProducto': 'Lux Accessories PAWtners in Crime Partners Necklace Matching Dog Tag Collar Keychain', 'PrecioProducto': 11.95}, {'NombreProducto': 'Luckey Friend Two-tone Ultrasonic Flute Dog Whistle Keychain for Pet Training', 'PrecioProducto': nan}, {'NombreProducto': 'Slushies Fix Everything - Metal Ring Key Chain Keychain', 'PrecioProducto': 12.95}, {'NombreProducto': 'Got Yo Gifts Pekingese Mirrored Acrylic Keychain', 'PrecioProducto': nan}]"
780,levels,"[{'NombreProducto': 'REGIROCK 2018 Upgrade Version Barking Control Collar - Rechargeable &amp; Rainproof No Bark Collar Sound, Vibration Static Shock - 7 Levels Sensitivity Small Medium Large Dog', 'PrecioProducto': 6.04}, {'NombreProducto': 'Aetertek AT-216 WATERPRROF 550 METER RANGE REMOTE CONTROL DOG SHOCK COLLAR TRAINER WITH BEEP SOUND,VIBRATION AND 7 LEVELS OF SHOCK FOR DOG BEHAVIORAL OBEDIENCE TRANING', 'PrecioProducto': 7.43}, {'NombreProducto': 'WATERPROOF RECHARGEABLE DOG TRAINER GT-211 350S-2: 400 YARD REMOTE RANGE 2-DOG TRAINER WITH 10 LEVELS OF ADJUSTABLE BEEP,VIBRATE,SHOCKS', 'PrecioProducto': nan}, {'NombreProducto': 'INCO NCO Bark Collar [2019 Upgraded] No Prongs, No Shock &amp; No Harm - Only Sound &amp; Vibration - Stay in Control with 7 Levels of Intensity - Rechargeable - Most Humane No Bark Collar', 'PrecioProducto': 6.04}, {'NombreProducto': 'HIGHOT Rechargeable Remote Pet Trainer LCD Digital Dog Training Electric Shock Collar with 100Levels and Vibration for 2 Dogs', 'PrecioProducto': nan}]"
781,wand,"[{'NombreProducto': 'Patchwork Pet Purrfect Magic Wand Display Toys (10 Wands + Cardboard Display) for Cats', 'PrecioProducto': nan}, {'NombreProducto': 'Replacement Wands for Pouncing Paws 2//Real Feather Wands by CAT1st', 'PrecioProducto': 31.36}, {'NombreProducto': 'lesotc Cat Toys Wand, 2PCS Cat Sticky Toys Rainbow Ribbon with Built in Bell, Teaser and Exerciser for Cat and Kitten', 'PrecioProducto': 9.99}, {'NombreProducto': 'Da Bee Fun Pack - Includes a Go Cat Da Bee Wand and Big Sky Cats Natural Buffalo Bumble Bee Attachment', 'PrecioProducto': nan}, {'NombreProducto': 'Kat Lure Bug Fly Cat Toy Wand Kit', 'PrecioProducto': 19.95}]"
782,patches,"[{'NombreProducto': '&quot;Service Dog&quot; Small nylon velcro patches by Dean &amp; Tyler.', 'PrecioProducto': 18.48}, {'NombreProducto': '&quot;Arson Dog&quot; Small nylon velcro patches by Dean &amp; Tyler.', 'PrecioProducto': 20.33}, {'NombreProducto': ""RedLine K9 Service Dog Coyote Brown Vest Harness with 2 Embroidered Coyote Brown 'ASK TO PET' Patches"", 'PrecioProducto': 66.47}, {'NombreProducto': 'Dogline MaxAire Multi-Purpose Mesh Vest for Dogs and 2 Removable Emotional Support Patches, Medium, Pink', 'PrecioProducto': 18.36}, {'NombreProducto': 'Dogline Diabetic Alert Removable Velcro Patches', 'PrecioProducto': 10.95}]"
783,sling,"[{'NombreProducto': 'Alfie Pet by Petoga Couture - Hayden Pet Sling Carrier', 'PrecioProducto': 28.99}, {'NombreProducto': 'Alfie Pet by Petoga Couture - Pula Sling Carrier', 'PrecioProducto': nan}, {'NombreProducto': 'Vktech Pet Doggy Cat Comfortable Sling Carrier Pouch Travel Traveler Tote Bag Handbag', 'PrecioProducto': 14.99}, {'NombreProducto': 'Wacky Paws Pet Sling, X-Large, Burgundy', 'PrecioProducto': nan}, {'NombreProducto': 'Kuke Pet Sling-Style Carrier Dog Cat Sling Travel Bag Small Size Pink', 'PrecioProducto': nan}]"
